{
  "schema_version": 1,
  "id": "extension.approved-acquisition",
  "name": "Approved Local and Pinned-GitHub Acquisition",
  "version": "0.1.0",
  "category": "integration",
  "status": "experimental",
  "optional": true,
  "entry_points": {
    "python_modules": [
      "Tools/approved_acquisition.py"
    ],
    "tools": [
      "Tools/approved_acquisition.py"
    ]
  },
  "capabilities": [
    "acquisition.bundle.verify",
    "acquisition.github.pinned.read",
    "acquisition.local.read",
    "acquisition.plan"
  ],
  "dependencies": [],
  "compatibility": {
    "game_versions": [
      "1.23.401"
    ],
    "branches": [
      "Mono"
    ],
    "runtime_targets": [
      "editor-only"
    ]
  },
  "provenance": {
    "origin": "theb0yys/FOA-SDK",
    "revision": "32f9cf074d11f9529f6cb570f2fd1071b206a95f",
    "license": "Apache-2.0 OR MIT",
    "redistribution_reviewed": true
  }
}
